[
  {
    "MS名": "ザクⅡFS型_LV1",
    "コスト": 150,
    "HP": 8500,
    "耐実弾補正": 6,
    "耐ビーム補正": 4,
    "耐格闘補正": 2,
    "射撃補正": 5,
    "格闘補正": 10,
    "スピード": 110,
    "高速移動": 170,
    "スラスター": 50,
    "旋回_地上_通常時": 60,
    "格闘判定力": "強",
    "カウンター": "投げ",
    "再出撃時間": 5,
    "近スロット": 4,
    "中スロット": 4,
    "遠スロット": 0,
    "属性": "汎用",
    "fullst": [
      {
        "name": "複合拡張パーツスロット",
        "level": 1,
        "points": 60
      },
      {
        "name": "プロペラントタンク",
        "level": 1,
        "points": 130
      },
      {
        "name": "フレーム補強",
        "level": 1,
        "points": 190
      },
      {
        "name": "AD-PA",
        "level": 1,
        "points": 330
      },
      {
        "name": "強化セキュリティ",
        "level": 1,
        "points": 660
      },
      {
        "name": "AD-PA",
        "level": 3,
        "points": 990
      }
    ]
  },
  {
    "MS名": "ザクⅡFS型_LV2",
    "コスト": 200,
    "HP": 10000,
    "耐実弾補正": 8,
    "耐ビーム補正": 6,
    "耐格闘補正": 4,
    "射撃補正": 5,
    "格闘補正": 15,
    "スピード": 110,
    "高速移動": 170,
    "スラスター": 50,
    "旋回_地上_通常時": 60,
    "格闘判定力": "強",
    "カウンター": "投げ",
    "再出撃時間": 7,
    "近スロット": 6,
    "中スロット": 4,
    "遠スロット": 2,
    "属性": "汎用",
    "fullst": [
      {
        "name": "複合拡張パーツスロット",
        "level": 1,
        "points": 90
      },
      {
        "name": "プロペラントタンク",
        "level": 1,
        "points": 180
      },
      {
        "name": "フレーム補強",
        "level": 1,
        "points": 270
      },
      {
        "name": "AD-PA",
        "level": 1,
        "points": 460
      },
      {
        "name": "強化セキュリティ",
        "level": 1,
        "points": 920
      },
      {
        "name": "AD-PA",
        "level": 3,
        "points": 1380
      }
    ]
  },
  {
    "MS名": "ザクⅡFS型_LV3",
    "コスト": 250,
    "HP": 11000,
    "耐実弾補正": 10,
    "耐ビーム補正": 8,
    "耐格闘補正": 6,
    "射撃補正": 5,
    "格闘補正": 20,
    "スピード": 110,
    "高速移動": 170,
    "スラスター": 50,
    "旋回_地上_通常時": 60,
    "格闘判定力": "強",
    "カウンター": "投げ",
    "再出撃時間": 8,
    "近スロット": 7,
    "中スロット": 5,
    "遠スロット": 4,
    "属性": "汎用",
    "fullst": [
      {
        "name": "複合拡張パーツスロット",
        "level": 1,
        "points": 120
      },
      {
        "name": "プロペラントタンク",
        "level": 1,
        "points": 240
      },
      {
        "name": "フレーム補強",
        "level": 1,
        "points": 360
      },
      {
        "name": "AD-PA",
        "level": 1,
        "points": 600
      },
      {
        "name": "強化セキュリティ",
        "level": 1,
        "points": 1200
      },
      {
        "name": "AD-PA",
        "level": 3,
        "points": 1800
      }
    ]
  },
  {
    "MS名": "ザクⅡFS型_LV4",
    "コスト": 300,
    "HP": 12500,
    "耐実弾補正": 12,
    "耐ビーム補正": 10,
    "耐格闘補正": 8,
    "射撃補正": 5,
    "格闘補正": 25,
    "スピード": 115,
    "高速移動": 170,
    "スラスター": 50,
    "旋回_地上_通常時": 60,
    "格闘判定力": "強",
    "カウンター": "投げ",
    "再出撃時間": 10,
    "近スロット": 9,
    "中スロット": 6,
    "遠スロット": 5,
    "属性": "汎用",
    "fullst": [
      {
        "name": "複合拡張パーツスロット",
        "level": 2,
        "points": 140
      },
      {
        "name": "プロペラントタンク",
        "level": 2,
        "points": 290
      },
      {
        "name": "フレーム補強",
        "level": 2,
        "points": 440
      },
      {
        "name": "AD-PA",
        "level": 2,
        "points": 740
      },
      {
        "name": "強化セキュリティ",
        "level": 1,
        "points": 1480
      },
      {
        "name": "AD-PA",
        "level": 3,
        "points": 2220
      }
    ]
  },
  {
    "MS名": "ザクⅡFS型_LV5",
    "コスト": 350,
    "HP": 13000,
    "耐実弾補正": 14,
    "耐ビーム補正": 12,
    "耐格闘補正": 10,
    "射撃補正": 5,
    "格闘補正": 30,
    "スピード": 115,
    "高速移動": 170,
    "スラスター": 50,
    "旋回_地上_通常時": 60,
    "格闘判定力": "強",
    "カウンター": "投げ",
    "再出撃時間": 12,
    "近スロット": 10,
    "中スロット": 7,
    "遠スロット": 7,
    "属性": "汎用",
    "fullst": [
      {
        "name": "複合拡張パーツスロット",
        "level": 2,
        "points": 170
      },
      {
        "name": "プロペラントタンク",
        "level": 2,
        "points": 350
      },
      {
        "name": "フレーム補強",
        "level": 2,
        "points": 520
      },
      {
        "name": "AD-PA",
        "level": 2,
        "points": 880
      },
      {
        "name": "強化セキュリティ",
        "level": 1,
        "points": 1760
      },
      {
        "name": "AD-PA",
        "level": 3,
        "points": 2640
      }
    ]
  },
  {
    "MS名": "ザクⅡFS型_LV6",
    "コスト": 400,
    "HP": 14500,
    "耐実弾補正": 16,
    "耐ビーム補正": 14,
    "耐格闘補正": 12,
    "射撃補正": 5,
    "格闘補正": 35,
    "スピード": 120,
    "高速移動": 170,
    "スラスター": 50,
    "旋回_地上_通常時": 60,
    "格闘判定力": "強",
    "カウンター": "投げ",
    "再出撃時間": 13,
    "近スロット": 13,
    "中スロット": 7,
    "遠スロット": 8,
    "属性": "汎用",
    "fullst": [
      {
        "name": "複合拡張パーツスロット",
        "level": 2,
        "points": 200
      },
      {
        "name": "プロペラントタンク",
        "level": 2,
        "points": 410
      },
      {
        "name": "フレーム補強",
        "level": 2,
        "points": 620
      },
      {
        "name": "AD-PA",
        "level": 2,
        "points": 1040
      },
      {
        "name": "強化セキュリティ",
        "level": 1,
        "points": 2080
      },
      {
        "name": "AD-PA",
        "level": 3,
        "points": 3120
      }
    ]
  },
  {
    "MS名": "パーフェクト・ガンダム【TB】_LV1",
    "コスト": 550,
    "HP": 16000,
    "耐実弾補正": 10,
    "耐ビーム補正": 25,
    "耐格闘補正": 25,
    "射撃補正": 25,
    "格闘補正": 30,
    "スピード": 130,
    "高速移動": 215,
    "スラスター": 70,
    "旋回_地上_通常時": 87,
    "旋回_宇宙_通常時": 87,
    "格闘判定力": "中",
    "カウンター": "通常：蹴り飛ばし 高性能：特殊",
    "再出撃時間": 14,
    "近スロット": 15,
    "中スロット": 15,
    "遠スロット": 10,
    "属性": "汎用",
    "fullst": [
      {
        "name": "AD-PA",
        "level": 1,
        "points": 770
      },
      {
        "name": "シールド構造強化",
        "level": 1,
        "points": 1540
      },
      {
        "name": "プロペラントタンク",
        "level": 1,
        "points": 2310
      },
      {
        "name": "複合拡張パーツスロット",
        "level": 1,
        "points": 3090
      },
      {
        "name": "AD-PA",
        "level": 4,
        "points": 6180
      },
      {
        "name": "緊急格闘防御機構",
        "level": 1,
        "points": 9270
      }
    ]
  },
  {
    "MS名": "パーフェクト・ガンダム【TB】_LV2",
    "コスト": 600,
    "HP": 18000,
    "耐実弾補正": 11,
    "耐ビーム補正": 27,
    "耐格闘補正": 27,
    "射撃補正": 31,
    "格闘補正": 37,
    "スピード": 135,
    "高速移動": 220,
    "スラスター": 75,
    "旋回_地上_通常時": 87,
    "旋回_宇宙_通常時": 87,
    "格闘判定力": "中",
    "カウンター": "通常：蹴り飛ばし 高性能：特殊",
    "再出撃時間": 15,
    "近スロット": 17,
    "中スロット": 17,
    "遠スロット": 13,
    "属性": "汎用"
  }
]