[
  {
    "MS名": "サザビー_LV1",
    "コスト": 700,
    "HP": 25000,
    "耐実弾補正": 18,
    "耐ビーム補正": 34,
    "耐格闘補正": 34,
    "射撃補正": 30,
    "格闘補正": 40,
    "スピード": 135,
    "高速移動": 230,
    "スラスター": 85,
    "旋回_地上_通常時": 81,
    "格闘判定力": "中",
    "カウンター": "通常：蹴り飛ばし 高性能：特殊",
    "再出撃時間": 16,
    "近スロット": 19,
    "中スロット": 13,
    "遠スロット": 20,
    "属性": "汎用",
    "fullst": [
      {
        "name": "AD-PA",
        "level": 1,
        "points": 1180
      },
      {
        "name": "シールド構造強化",
        "level": 1,
        "points": 2360
      },
      {
        "name": "強化セキュリティ",
        "level": 3,
        "points": 3150
      },
      {
        "name": "複合拡張パーツスロット",
        "level": 1,
        "points": 3940
      },
      {
        "name": "支援砲撃耐性",
        "level": 3,
        "points": 7880
      },
      {
        "name": "緊急格闘防御機構",
        "level": 1,
        "points": 11820
      }
    ]
  },
  {
    "MS名": "サザビー_LV2",
    "コスト": 750,
    "HP": 27000,
    "耐実弾補正": 20,
    "耐ビーム補正": 36,
    "耐格闘補正": 36,
    "射撃補正": 33,
    "格闘補正": 44,
    "スピード": 140,
    "高速移動": 230,
    "スラスター": 85,
    "旋回_地上_通常時": 81,
    "格闘判定力": "中",
    "カウンター": "通常：蹴り飛ばし 高性能：特殊",
    "再出撃時間": 16,
    "近スロット": 21,
    "中スロット": 15,
    "遠スロット": 22,
    "属性": "汎用",
    "fullst": [
      {
        "name": "AD-PA",
        "level": 1,
        "points": null
      },
      {
        "name": "シールド構造強化",
        "level": 1,
        "points": null
      },
      {
        "name": "強化セキュリティ",
        "level": 3,
        "points": null
      },
      {
        "name": "複合拡張パーツスロット",
        "level": 1,
        "points": null
      },
      {
        "name": "支援砲撃耐性",
        "level": 3,
        "points": null
      },
      {
        "name": "緊急格闘防御機構",
        "level": 1,
        "points": null
      }
    ]
  }
]