[
  {
    "MS名": "F90［MZ仕様］_LV1",
    "コスト": 700,
    "HP": 22000,
    "耐実弾補正": 20,
    "耐ビーム補正": 26,
    "耐格闘補正": 32,
    "射撃補正": 25,
    "格闘補正": 45,
    "スピード": 145,
    "高速移動": 225,
    "スラスター": 75,
    "旋回_地上_通常時": 81,
    "旋回_宇宙_通常時": 90,
    "格闘判定力": "強",
    "カウンター": "蹴り飛ばし",
    "再出撃時間": 16,
    "近スロット": 21,
    "中スロット": 20,
    "遠スロット": 11,
    "属性": "強襲",
    "fullst": [
      {
        "name": "耐格闘装甲補強",
        "level": 1,
        "points": 660
      },
      {
        "name": "AD-PA",
        "level": 1,
        "points": 1330
      },
      {
        "name": "冷却補助システム",
        "level": 1,
        "points": 2000
      },
      {
        "name": "複合拡張パーツスロット",
        "level": 1,
        "points": 2670
      },
      {
        "name": "耐格闘装甲補強",
        "level": 4,
        "points": 5340
      },
      {
        "name": "AD-PA",
        "level": 4,
        "points": 8010
      }
    ]
  },
  {
    "MS名": "F90［MZ仕様］_LV2",
    "コスト": 750,
    "HP": 23000,
    "耐実弾補正": 22,
    "耐ビーム補正": 28,
    "耐格闘補正": 34,
    "射撃補正": 28,
    "格闘補正": 49,
    "スピード": 145,
    "高速移動": 225,
    "スラスター": 75,
    "旋回_地上_通常時": 81,
    "旋回_宇宙_通常時": 90,
    "格闘判定力": "強",
    "カウンター": "蹴り飛ばし",
    "再出撃時間": 16,
    "近スロット": 23,
    "中スロット": 21,
    "遠スロット": 12,
    "属性": "強襲",
    "fullst": [
      {
        "name": "耐格闘装甲補強",
        "level": 1,
        "points": 770
      },
      {
        "name": "AD-PA",
        "level": 1,
        "points": 1540
      },
      {
        "name": "冷却補助システム",
        "level": 1,
        "points": 2310
      },
      {
        "name": "複合拡張パーツスロット",
        "level": 1,
        "points": 3080
      },
      {
        "name": "耐格闘装甲補強",
        "level": 4,
        "points": 6160
      },
      {
        "name": "AD-PA",
        "level": 4,
        "points": 9240
      }
    ]
  }
]